{
 "fixture_version": "1.0",
 "name": "company-b",
 "synthetic": true,
 "description": "Synthetic Company B case with planted clues: the held-out counterpart of company-a.json, the same clue groups on a different invented firm, so no case is in both halves. All names, registers and domains are invented (.test). Gold answers are set by construction; null means the item is not scored on that question.",
 "case": {
  "case_id": "company-b",
  "case_key": "company-b",
  "premise": "Company B, a Basel waste-transport firm, won municipal contracts after its ownership passed to an undisclosed holder in 2025.",
  "directions": {
   "ownership": "Who owns Company B",
   "contracts": "Which municipal contracts Company B won",
   "people": "Who runs Company B"
  },
  "direction_questions": {
   "ownership": [
    "Who has held Company B's shares since 2025?"
   ],
   "contracts": [
    "Which contracts did Company B win in 2025?"
   ],
   "people": [
    "Who are Company B's directors?"
   ]
  },
  "topics": [
   {
    "topic_id": "ownership-registries",
    "direction_id": "ownership",
    "lane_type": "registries"
   },
   {
    "topic_id": "ownership-archives",
    "direction_id": "ownership",
    "lane_type": "archives"
   },
   {
    "topic_id": "contracts-news-courts",
    "direction_id": "contracts",
    "lane_type": "news-courts"
   },
   {
    "topic_id": "people-web",
    "direction_id": "people",
    "lane_type": "web"
   },
   {
    "topic_id": "people-social",
    "direction_id": "people",
    "lane_type": "social"
   }
  ],
  "timing_window_days": 30
 },
 "items": [
  {
   "item_id": "cb-h01",
   "split": "heldout",
   "origin": "synthetic",
   "lead": {
    "schema_version": "1.0",
    "lead_id": "cb-h01",
    "topic_id": "ownership-archives",
    "direction_id": "ownership",
    "summary": "The gazette records Orsana Holding as Company B's majority shareholder.",
    "subjects": [
     "Company B",
     "Orsana Holding"
    ],
    "absence": false,
    "status": "candidate",
    "stored": "page",
    "capture": {
     "route": "api",
     "tool": "firecrawl",
     "source_url": "https://archive-ch.test/gazette/2025-06-02",
     "captured_at": "2026-10-23T09:00:00Z"
    },
    "provenance": {
     "method": "agent_candidate",
     "model": "synthetic/company-b"
    },
    "excerpt": {
     "text": "Company B AG: majority shareholder Orsana Holding SA, Geneva (entered 2025-06-02).",
     "language": "en",
     "direct_quote": true
    },
    "content_ref": "sources/e99f1daadb05d051846dc8bc2f513b369f9bdbf282cb918da58f83cd5e4ef295.md",
    "content_sha256": "e99f1daadb05d051846dc8bc2f513b369f9bdbf282cb918da58f83cd5e4ef295"
   },
   "gold": {
    "keep": true,
    "answers": {
     "q1_identity": "consistent_details",
     "q3_source": "primary_record",
     "q4_assertion": "asserted",
     "q5_status": "done",
     "q6_fidelity": "faithful",
     "c1_premise": "supports",
     "c2_new_actor": true
    },
    "label_source": "by_construction"
   }
  },
  {
   "item_id": "cb-h02",
   "split": "heldout",
   "origin": "synthetic",
   "lead": {
    "schema_version": "1.0",
    "lead_id": "cb-h02",
    "topic_id": "people-social",
    "direction_id": "people",
    "summary": "A report says Orsana Holding took control of Company B through a Geneva lawyer.",
    "subjects": [
     "Company B",
     "Orsana Holding"
    ],
    "absence": false,
    "status": "candidate",
    "stored": "page",
    "capture": {
     "route": "api",
     "tool": "firecrawl",
     "source_url": "https://news-two.test/2025/orsana",
     "captured_at": "2026-10-23T09:00:00Z"
    },
    "provenance": {
     "method": "agent_candidate",
     "model": "synthetic/company-b"
    },
    "excerpt": {
     "text": "Orsana Holding, which took control of Company B, is represented by a Geneva lawyer who declined to name its owners.",
     "language": "en",
     "direct_quote": true
    },
    "content_ref": "sources/32dcb8e5463fa27217e8250d398a4e67f5e922cac28b59094495918bbfeea6a2.md",
    "content_sha256": "32dcb8e5463fa27217e8250d398a4e67f5e922cac28b59094495918bbfeea6a2"
   },
   "gold": {
    "keep": true,
    "answers": {
     "q1_identity": "consistent_details",
     "q3_source": "original_reporting",
     "q4_assertion": "asserted",
     "q5_status": "done",
     "q6_fidelity": "faithful",
     "c1_premise": "supports",
     "c2_new_actor": true
    },
    "label_source": "by_construction"
   }
  },
  {
   "item_id": "cb-h03",
   "split": "heldout",
   "origin": "synthetic",
   "lead": {
    "schema_version": "1.0",
    "lead_id": "cb-h03",
    "topic_id": "people-web",
    "direction_id": "people",
    "summary": "Petra Valsky is Company B's managing director.",
    "subjects": [
     "Company B",
     "Petra Valsky"
    ],
    "absence": false,
    "status": "candidate",
    "stored": "page",
    "capture": {
     "route": "api",
     "tool": "firecrawl",
     "source_url": "https://register-ch.test/entity/che-210.320.430/management",
     "captured_at": "2026-10-23T09:00:00Z"
    },
    "provenance": {
     "method": "agent_candidate",
     "model": "synthetic/company-b"
    },
    "excerpt": {
     "text": "Company B AG. Managing director: Petra Valsky, joint signature.",
     "language": "en",
     "direct_quote": true
    },
    "content_ref": "sources/bfd3b93d9cab2de69b17684fbf59c29f5500e0af1762d43bc1aa22d269ac6a1a.md",
    "content_sha256": "bfd3b93d9cab2de69b17684fbf59c29f5500e0af1762d43bc1aa22d269ac6a1a"
   },
   "gold": {
    "keep": true,
    "answers": {
     "q1_identity": "consistent_details",
     "q3_source": "primary_record",
     "q4_assertion": "asserted",
     "q5_status": "done",
     "q6_fidelity": "faithful",
     "c2_new_actor": true
    },
    "label_source": "by_construction"
   }
  },
  {
   "item_id": "cb-h04",
   "split": "heldout",
   "origin": "synthetic",
   "lead": {
    "schema_version": "1.0",
    "lead_id": "cb-h04",
    "topic_id": "ownership-registries",
    "direction_id": "ownership",
    "summary": "Company B moved its registered office from Basel to Zug in April 2025.",
    "subjects": [
     "Company B"
    ],
    "absence": false,
    "status": "candidate",
    "stored": "page",
    "capture": {
     "route": "api",
     "tool": "firecrawl",
     "source_url": "https://register-ch.test/entity/che-210.320.430/seat",
     "captured_at": "2026-10-23T09:00:00Z"
    },
    "provenance": {
     "method": "agent_candidate",
     "model": "synthetic/company-b"
    },
    "excerpt": {
     "text": "Company B AG moves its registered office from Basel to Zug (entry of 2025-04-11).",
     "language": "en",
     "direct_quote": true
    },
    "content_ref": "sources/c3b842f322d1460e4761fab94f0f01ca6b2fb78169400b17204fdca352dd64d0.md",
    "content_sha256": "c3b842f322d1460e4761fab94f0f01ca6b2fb78169400b17204fdca352dd64d0"
   },
   "gold": {
    "keep": true,
    "answers": {
     "q1_identity": "consistent_details",
     "q3_source": "primary_record",
     "q4_assertion": "asserted",
     "q5_status": "done",
     "q6_fidelity": "faithful",
     "c2_new_actor": false,
     "c3_change": true
    },
    "label_source": "by_construction"
   }
  },
  {
   "item_id": "cb-h05",
   "split": "heldout",
   "origin": "synthetic",
   "lead": {
    "schema_version": "1.0",
    "lead_id": "cb-h05",
    "topic_id": "ownership-archives",
    "direction_id": "ownership",
    "summary": "A correction backdates Company B's board change to the end of 2024.",
    "subjects": [
     "Company B"
    ],
    "absence": false,
    "status": "candidate",
    "stored": "page",
    "capture": {
     "route": "api",
     "tool": "firecrawl",
     "source_url": "https://archive-ch.test/gazette/2025-07-02",
     "captured_at": "2026-10-23T09:00:00Z"
    },
    "provenance": {
     "method": "agent_candidate",
     "model": "synthetic/company-b"
    },
    "excerpt": {
     "text": "Correction of 2025-07-02: the board change of Company B AG is entered with effect from 2024-12-31.",
     "language": "en",
     "direct_quote": true
    },
    "content_ref": "sources/48f592ef1690ded6c56a88a53377e7192091cd5322c44bfce981f8d8f0398f86.md",
    "content_sha256": "48f592ef1690ded6c56a88a53377e7192091cd5322c44bfce981f8d8f0398f86"
   },
   "gold": {
    "keep": true,
    "answers": {
     "q1_identity": "consistent_details",
     "q3_source": "primary_record",
     "q4_assertion": "asserted",
     "q5_status": "done",
     "q6_fidelity": "faithful",
     "c2_new_actor": false,
     "c3_change": true
    },
    "label_source": "by_construction"
   }
  },
  {
   "item_id": "cb-h06",
   "split": "heldout",
   "origin": "synthetic",
   "lead": {
    "schema_version": "1.0",
    "lead_id": "cb-h06",
    "topic_id": "ownership-archives",
    "direction_id": "ownership",
    "summary": "No record found: Company B procurement appeal court docket.",
    "subjects": [
     "Company B"
    ],
    "absence": true,
    "queries_tried": [
     "Company B procurement appeal court docket"
    ],
    "status": "candidate"
   },
   "gold": {
    "keep": true,
    "label_source": "by_construction"
   }
  },
  {
   "item_id": "cb-h07",
   "split": "heldout",
   "origin": "synthetic",
   "lead": {
    "schema_version": "1.0",
    "lead_id": "cb-h07",
    "topic_id": "contracts-news-courts",
    "direction_id": "contracts",
    "summary": "Company B employs 85 drivers.",
    "subjects": [
     "Company B"
    ],
    "absence": false,
    "status": "candidate",
    "stored": "page",
    "capture": {
     "route": "api",
     "tool": "firecrawl",
     "source_url": "https://news-one.test/2025/drivers",
     "captured_at": "2026-10-23T09:00:00Z"
    },
    "provenance": {
     "method": "agent_candidate",
     "model": "synthetic/company-b"
    },
    "excerpt": {
     "text": "Company B AG employs 85 drivers on its municipal routes.",
     "language": "en",
     "direct_quote": true
    },